{
  "taskId": "fixture-eshkol-closure-derive-001",
  "rootTaskId": "fixture-eshkol-closure-derive-001",
  "serviceId": "eshkol",
  "taskKind": "eshkol.closure.derive",
  "inputs": [
    {
      "tensorId": "rho-grid",
      "dtype": "f32",
      "shape": [16],
      "layout": "row-major",
      "source": "hot"
    }
  ],
  "outputs": [
    {
      "artifactKind": "closure",
      "artifactSchema": "closure_artifact.schema.json"
    }
  ],
  "unitsHash": "ulg:fixture-units-v0.5",
  "inputHash": "ulg:fixture-input-eshkol-001",
  "methodHash": "ulg:fixture-method-eshkol-001",
  "deterministicSeed": "fixture-seed-v0.5",
  "resources": {
    "childWorkers": 2,
    "gpu": "optional",
    "wasmMemoryBytes": 8388608,
    "gpuMemoryBytes": 4194304,
    "priority": "simulation"
  },
  "validation": {
    "mode": "self",
    "toleranceProfile": "demo-parity"
  },
  "provenance": {
    "sourceService": "eshkol",
    "methodHash": "ulg:fixture-method-eshkol-001",
    "inputHash": "ulg:fixture-input-eshkol-001",
    "codeVersion": "ulg-service-contract-fixture",
    "deterministicSeed": "fixture-seed-v0.5",
    "createdAt": "2026-06-05T00:00:00.000Z",
    "notes": ["cross-repo fixture"]
  }
}
